Date,Location,Raw,Speakers,Time,Description,Hosts,Issue date
"June 10, 1910","Southport, Temperance Institute","Friday , June 10. - Temperance Institute , Dr. Bushnell , Miss Marsden , B.A. 3.30 p.m.","['Dr. Bushnell', 'Miss Marsden']",3.30 p.m.,,,"June 3, 1910"
"June 14, 1910","Southport, Temperance Institute","On June 14 Miss Adela Pankhurst and Miss Lillian Williamson , B.A. , will speak at the Temperance Institute .","['Miss Adela Pankhurst', 'Miss Lillian Williamson']",,,,"June 3, 1910"
"June 3, 1910","Glasgow, West End Park","Friday , June 3. - West End Park , Miss Graham , Miss Wylle .","['Miss Graham', 'Miss Wylle']",,,,"June 3, 1910"
"June 7, 1910","Glasgow, Springburn","Tuesday , June 7. - Springburn , Miss Kerry , Miss Hunter .","['Miss Kerry', 'Miss Hunter']",,,,"June 3, 1910"
"June 3, 1910",Dalkeith,"Friday , June 3. - Dalkeith , Open - air Meeting , Miss A. Scott , 8 p.m.",['Miss A. Scott'],8 p.m.,,,"June 3, 1910"
"June 4, 1910",Roslyn,"Saturday , June 4. - Roslyn , Miss Burns , 5.30 p.m.",['Miss Burns'],5.30 p.m.,,,"June 3, 1910"
"June 18, 1910",London,"in view of the great Procession on June 18 , to organise which all the energies of every member will be required , it is recommended that as many as possible should avail themselves of these special opportunities .",,,,,"June 3, 1910"
Saturdays 3:30 p.m.,"2, Campden Hill Square, London","On Saturday afternoons , through the kindness of the Misses Brackenbury , Miss Rosa Leo conducts a class at 2 , Campden Hill Square , at 3.30 p.m.",['Miss Rosa Leo'],3:30 p.m.,,,"June 3, 1910"
Tuesdays and Fridays 7:45 p.m.,"2, Campden Hill Square, London","Miss Leo now conducts in addition private classes every Tuesday and Friday evening at 7.45 at the same address, and there are a few vacancies for pupils in these private classes ..",['Miss Rosa Leo'],7:45 p.m.,,,"June 3, 1910"
"First week in October, 1910",Southport,"The W.S.P.U. have taken a permanent office at 13 Nevill Street . These are to be the head- quarters for the Great Lancashire Suffrage Pageant and Bazaar , which is to be held in Southport , the first week in October .",,,,,"June 3, 1910"
"Summer, 1910",Thanet,the Canterbury and Thanet Organiser sends us some suggestions for banners sent her by a public schoolboy who is looking forward to helping in the summer campaign in Thanet,,,summer campaign,,"June 3, 1910"
"June 5, 1910","The Ethical Church, 46, Queen's Rd., Bayswater","SUNDAY , June 5th.-DR. STANTON COIT : 11 a.m. , Ibsen's Enemy of the People . "" 7 p.m. , Bjornson's "" Beyond Human Strength . """,['DR. STANTON COIT'],11 a.m.,,,"June 3, 1910"
"June 5, 1910","The Ethical Church, 46, Queen's Rd., Bayswater","SUNDAY , June 5th.-DR. STANTON COIT : 11 a.m. , Ibsen's Enemy of the People . "" 7 p.m. , Bjornson's "" Beyond Human Strength . """,['DR. STANTON COIT'],7 p.m.,,,"June 3, 1910"
"June 8, 1910","The Ethical Church, 46, Queen's Rd., Bayswater","WEDNESDAY , June 8th , 8.30 p.m. - Can we act con- trary to our own Nature ?",,8.30 p.m.,Can we act contrary to our own Nature ?,,"June 3, 1910"
